{
  "expected_spans": [
    {
      "detector": "iban",
      "start": 130,
      "end": 152,
      "text": "DE91100100100567891234"
    }
  ],
  "expected_action": "mask",
  "must_not_appear_in_output": [
    "DE91100100100567891234"
  ],
  "notes": "Quoted-printable body with a soft line break (=\\r\\n) splitting the IBAN digits mid-token"
}
