{
  "expected_spans": [
    {
      "detector": "credit_card",
      "start": 136,
      "end": 152,
      "text": "4242424242424242"
    }
  ],
  "expected_action": "mask",
  "must_not_appear_in_output": [
    "4242424242424242"
  ],
  "notes": "English SaaS payment confirmation, card number in plain body, realistic straightforward case"
}
